{"$schema":"https://json-schema.org/draft/2020-12/schema","type":"object","required":["job_id","overall_status","checks","required_revisions"],"properties":{"job_id":{"type":"string"},"overall_status":{"type":"string","enum":["pass","review_required","fail"]},"checks":{"type":"array","items":{"type":"object","required":["name","status","notes"],"properties":{"name":{"type":"string"},"status":{"type":"string"},"notes":{"type":"string"}}}},"required_revisions":{"type":"array","items":{"type":"string"}}}}
